{
  "number": "N-231",
  "date": "14.08.2026",
  "seller": {
    "name": "Cyber Capybara ТОО",
    "identifier": "104332181962",
    "address": "г. Алматы, ул. Абая, 150, оф. 12",
    "iik": "KZ123456789012345678",
    "bik": "HSBKKZKX",
    "bank": "АО «Народный Банк Казахстана»",
    "kbe": "17"
  },
  "buyer": {
    "name": "ТОО СтройМонтаж",
    "identifier": "001338908381",
    "address": "г. Астана, пр. Мангилик Ел, 55"
  },
  "basis": "Требование-накладная № 5 от 10.08.2026",
  "items": [
    {
      "name": "Бумага А4 80г/м²",
      "qty": "50",
      "unit": "пач",
      "price": "1 200,00",
      "amount": "60 000,00"
    },
    {
      "name": "Картриджи для принтера",
      "qty": "3",
      "unit": "шт",
      "price": "15 000,00",
      "amount": "45 000,00"
    }
  ],
  "total": "105 000,00",
  "total_words": "Сто пять тысяч тенге 00 тиын",
  "released_by": "Кладовщик Ахметова Г.С.",
  "received_by": "Менеджер Дюсенов Б.К."
}
